{
  "@context": [
    "https://www.w3.org/2018/credentials/v1",
    "http://localhost:8443/docs/vp.schema.html"
  ],
  "type": [
    "VerifiablePresentation"
  ],
  "verifiableCredential": [
    {
      "@context": [
        "https://www.w3.org/2018/credentials/v1",
        "http://localhost:8443/docs/vc.serviceAccess.schema.html"
      ],
      "id": "urn:uuid:a1fd774e-5300-4171-b778-e53cedb64823",
      "type": [
        "VerifiableCredential",
        "CloudInstance"
      ],
      "issuer": "did:batterypass:bms.sn-544b51e7",
      "holder": "did:batterypass:cloud.sn-cloud1",
      "issuanceDate": "2025-06-17T16:17:43Z",
      "expirationDate": "2026-06-17T16:17:43Z",
      "credentialSubject": {
        "id": "did:batterypass:cloud.sn-cloud1",
        "type": "CloudInstance",
        "cloudDid": "did:batterypass:cloud.sn-cloud1",
        "timestamp": "2026-06-17T16:17:43Z"
      },
      "proof": {
        "type": "EcdsaSecp256r1Signature2019",
        "created": "2025-06-17T16:17:43Z",
        "verificationMethod": "did:batterypass:bms.sn-544b51e7#key-1",
        "proofPurpose": "authentication",
        "jws": ""
      }
    }
  ],
  "holder": "did:batterypass:cloud.sn-cloud1",
  "proof": {
    "type": "EcdsaSecp256r1Signature2019",
    "created": "2025-08-01T09:00:00Z",
    "verificationMethod": "did:batterypass:cloud.sn-cloud1#key-1",
    "challenge": "c82f7883-42a1-4b78-9c2e-d8d5321af9f8",
    "proofPurpose": "authentication",
    "jws": ""
  }
}
